{
  "schema_version": "tspi-provider-descriptor/1",
  "provider_id": "script.bash",
  "kind": "compute",
  "capabilities": [{"id": "script.bash", "version": "1"}],
  "implementation": "adapter",
  "operation": "script.bash",
  "version": "1",
  "input_schema": {
    "type": "object",
    "required": ["script"],
    "properties": {
      "script": {"type": "string", "pattern": "^art_[0-9a-f]{64}$"}
    },
    "additionalProperties": false
  },
  "parameter_schema": {
    "type": "object",
    "properties": {
      "args": {"type": "array", "maxItems": 64, "items": {"type": "string", "maxLength": 4096}},
      "output_manifest": {
        "type": "array",
        "minItems": 1,
        "maxItems": 64,
        "items": {"type": "string", "pattern": "^[A-Za-z0-9][A-Za-z0-9_.-]{0,127}$"}
      }
    },
    "additionalProperties": false
  },
  "result_schema": {
    "type": "object",
    "required": ["status"],
    "properties": {"status": {"type": "string"}},
    "additionalProperties": true
  },
  "output_roles": ["program_output", "script_result"],
  "effects": ["local_prepare", "local_compute", "local_parse"],
  "limits": {"timeout_seconds": 3600, "max_args": 64, "max_outputs": 64}
}
