{
  "operation": "artifact_render",
  "version": "1",
  "input_schema": {
    "type": "object"
  },
  "parameter_schema": {
    "type": "object"
  },
  "result_schema": {
    "type": "object"
  },
  "output_roles": [
    "artifact"
  ],
  "effects": [
    "artifact_write"
  ],
  "limits": {
    "timeout_seconds": 300
  },
  "schema_version": "tspi-provider-descriptor/1",
  "provider_id": "artifact_render",
  "kind": "render",
  "capabilities": [
    {
      "id": "artifact_render",
      "version": "1"
    }
  ],
  "implementation": "adapter"
}
