{
  "schema_version": "tspi-provider-descriptor/1",
  "provider_id": "chemical.analysis",
  "kind": "analysis",
  "capabilities": [
    {
      "id": "chemical.analysis",
      "version": "1",
      "aliases": [
        "chemical.name.resolve",
        "reaction.parse",
        "reaction.validate",
        "reaction.mapping.validate",
        "reaction.mapping.generate"
      ]
    }
  ],
  "implementation": "builtin",
  "notes": "Inventory entry for deterministic chemical analysis capabilities.",
  "operation": "chemical.analysis",
  "version": "1",
  "input_schema": {
    "type": "object"
  },
  "parameter_schema": {
    "type": "object"
  },
  "result_schema": {
    "type": "object"
  },
  "output_roles": [
    "artifact"
  ],
  "effects": [
    "artifact_write"
  ],
  "limits": {
    "timeout_seconds": 3600
  }
}
