{
  "schema_version": "tspi-provider-descriptor/1",
  "provider_id": "xtb",
  "kind": "compute",
  "capabilities": [
    {
      "id": "xtb",
      "version": "1",
      "aliases": [
        "xtb.sp",
        "xtb.opt",
        "xtb.freq",
        "xtb.opt_freq"
      ]
    }
  ],
  "implementation": "builtin",
  "notes": "Inventory entry for the Native xTB capability catalog.",
  "operation": "xtb",
  "version": "1",
  "input_schema": {
    "type": "object"
  },
  "parameter_schema": {
    "type": "object"
  },
  "result_schema": {
    "type": "object"
  },
  "output_roles": [
    "artifact"
  ],
  "effects": [
    "artifact_write"
  ],
  "limits": {
    "timeout_seconds": 3600
  }
}
