{
  "operation": "report_build",
  "version": "1",
  "input_schema": {
    "type": "object"
  },
  "parameter_schema": {
    "type": "object"
  },
  "result_schema": {
    "type": "object"
  },
  "output_roles": [
    "report"
  ],
  "effects": [
    "artifact_write"
  ],
  "limits": {
    "timeout_seconds": 300
  },
  "schema_version": "tspi-provider-descriptor/1",
  "provider_id": "report_build",
  "kind": "report",
  "capabilities": [
    {
      "id": "report_build",
      "version": "1"
    }
  ],
  "implementation": "adapter"
}
