{
  "schema_version": "tspi-provider-descriptor/1",
  "provider_id": "crest",
  "kind": "compute",
  "capabilities": [
    {
      "id": "crest.conformer_search",
      "version": "1"
    }
  ],
  "implementation": "builtin",
  "notes": "Inventory entry for the Native CREST capability catalog.",
  "operation": "crest",
  "version": "1",
  "input_schema": {
    "type": "object"
  },
  "parameter_schema": {
    "type": "object"
  },
  "result_schema": {
    "type": "object"
  },
  "output_roles": [
    "artifact"
  ],
  "effects": [
    "artifact_write"
  ],
  "limits": {
    "timeout_seconds": 3600
  }
}
