{
  "schema_version": "tspi-provider-descriptor/1",
  "provider_id": "pyscf",
  "kind": "compute",
  "capabilities": [
    {
      "id": "pyscf.sp",
      "version": "1",
      "aliases": [
        "pyscf.opt",
        "pyscf.ts",
        "pyscf.freq",
        "pyscf.thermo",
        "pyscf.opt_freq",
        "pyscf.ts_freq"
      ]
    }
  ],
  "implementation": "builtin",
  "notes": "Inventory entry for the Native PySCF capability catalog.",
  "operation": "pyscf",
  "version": "1",
  "input_schema": {
    "type": "object"
  },
  "parameter_schema": {
    "type": "object"
  },
  "result_schema": {
    "type": "object"
  },
  "output_roles": [
    "artifact"
  ],
  "effects": [
    "artifact_write"
  ],
  "limits": {
    "timeout_seconds": 3600
  }
}
