{
  "schema_version": "tspi-provider-descriptor/1",
  "provider_id": "chemical.analysis",
  "kind": "analysis",
  "capabilities": [
    {
      "id": "chemical.name.resolve",
      "version": "1",
      "aliases": [
        "reaction.parse",
        "reaction.validate",
        "reaction.mapping.validate",
        "reaction.mapping.generate",
        "reaction.bond_changes",
        "structure.reindex",
        "structure.assemble_fragments",
        "species.identity",
        "gaussian.output.analyze",
        "gaussian.input.build",
        "path.extract_candidate",
        "vibration.analyze_mode",
        "path.endpoint_summary",
        "mechanism.step.audit",
        "thermochemistry.evaluate",
        "barrier.evaluate",
        "kinetics.tst",
        "kinetics.branching",
        "mechanism.step.define",
        "mechanism.network.assemble",
        "mechanism.network.audit",
        "mechanism.energy_profile"
      ]
    }
  ],
  "implementation": "builtin",
  "notes": "Inventory entry for deterministic chemical analysis capabilities.",
  "operation": "chemical.analysis",
  "version": "1",
  "input_schema": {
    "type": "object"
  },
  "parameter_schema": {
    "type": "object"
  },
  "result_schema": {
    "type": "object"
  },
  "output_roles": [
    "artifact"
  ],
  "effects": [
    "artifact_write"
  ],
  "limits": {
    "timeout_seconds": 3600
  }
}
